https://hdl.handle.net/2027/njp.32101075672749	Pulse in Verbal Rhythm	Hallock-Greenewalt, Mary.	Poet lore.	1905	Washington		vol.16 (1905)	79-85	233-239	correct	7	2018-01-23 14:56:27	2021-08-05 09:51:58	Article	njp.32101075672749		
https://hdl.handle.net/2027/njp.32101075729960	A Quantitative Study of Rhythm: The Effect of Variations in Intensity, Rate, and Duration	Woodrow, Herbert.	Archives of psychology.	1911	New York		vol.2 (no. 1-18) (1908-11)	1-66	333-400	correct	68	2018-01-23 14:56:15	2021-08-05 09:51:56	Article	njp.32101075729960		
https://hdl.handle.net/2027/hvd.32044098627433	Quantity and Sentence-Stress in English	Sweet, Henry.	Transactions of the Philological Society	1881	Oxford [etc.]	Society by B. Blackwell	1880-1881	26-27	770-771	772-773	2	2018-01-23 14:41:55	2023-04-25 12:48:30	Article	hvd.32044098627433		
https://hdl.handle.net/2027/uc1.b3885859	Quantity in English Verse	Goodell, Thomas D.	Transactions of the American Philological Association	1885	Boston [etc.]	Ginn & Co. [etc.]	v.16	78-103	84-109	correct	26	2018-01-23 15:09:56	2021-08-05 09:52:09	Article	uc1.b3885859		
https://hdl.handle.net/2027/mdp.39015060429530	Quantity Marks in Old English MSS	Hulme, William H.	Modern language notes.	1896	Baltimore	Johns Hopkins Press [etc.]	v.11 1896	9-12	27-30	29-32	4	2018-01-23 14:47:44	2021-08-05 09:51:39	Article	mdp.39015060429530		
https://hdl.handle.net/2027/njp.32101077288213	The Quasi-Caesura in Vergil	Sandford, P	Hermathena.	1901	Dublin	University of Dublin	vol.11	110-21	126-137	correct	12	2018-01-23 14:55:25	2021-08-05 09:51:47	Article	njp.32101077288213		
https://hdl.handle.net/2027/mdp.39076000323746	The Rationale of Verse	Poe, Edgar Allan.	The Southern literary messenger :	1848	New York	AMS Press	v.14 1848	577-85, 673-82	593-601, 689-698	589-597, 685-694	19	2018-01-23 14:46:21	2021-08-05 09:51:37	Article	mdp.39076000323746		
https://hdl.handle.net/2027/inu.32000000683138	The Reason for Rhyme	Maynard, Theodore.	The freeman.	1924	New York, N.Y.	The Freeman Inc.	v.8	469-70	491-492	correct	2	2021-01-14 15:54:24	2023-03-02 13:50:10	Article	inu.32000000683138		
https://hdl.handle.net/2027/mdp.39015027588287	The Reason for Rhyme	Maynard, Theodore	The freeman.	1924	New York, N.Y.	The Freeman Inc.	v.8	469-70	493-494	correct	2	2021-01-14 15:54:23	2023-03-02 13:50:10	Article	mdp.39015027588287		
https://hdl.handle.net/2027/mdp.39015073107768	Reflections on Vers Libre	Eliot, T. S.	New Statesman.	1917	London		v.8 Oct-Mar 1916-1917	518-19	548-549	correct	2	2018-01-23 14:46:40	2021-08-05 09:51:37	Article	mdp.39015073107768		
https://hdl.handle.net/2027/coo.31924057525671	Refrains	R., J. F.	The spectator	1913	London	F.C. Westley	v.110 1913	875-876	893-894	889-890	2	2018-01-23 14:32:52	2021-08-05 09:51:22	Article	coo.31924057525671		
https://hdl.handle.net/2027/hvd.32044092711480	The Relation of Music to Poetry	Hayes, Alfred	Atlantic monthly	1914	Boston	Atlantic Monthly Co.	v.113 (1914)	59-69	71-81	correct	11	2018-01-23 14:42:29	2021-08-05 09:51:29	Article	hvd.32044092711480		
https://hdl.handle.net/2027/uc1.b3924126	Remarks and Experiments on English Hexameters	Cayley, C[harles] B[agot].	Transactions of the Philological Society	1863	Oxford [etc.]	Society by B. Blackwell	1862/63	67-85	79-97	correct	19	2018-01-23 15:09:53	2021-08-05 09:52:09	Article	uc1.b3924126		
https://hdl.handle.net/2027/hvd.32044038400958	Remarks on English Hexameters	Blackie, John Stuart	Horae Hellenicæ, essays and discussion on some important points of Greek philology and antiquity;	1874	London	Macmillan & co.		278-96	296-314	correct	19	2021-08-05 09:54:13	2021-08-05 09:54:13	Excerpt	hvd.32044038400958		
https://hdl.handle.net/2027/hvd.32044092797232	The Reputation of John Donne as Metrist	Nethercot, Arthur H.	The Sewanee review.	1922	Sewanee, Tenn. [etc.]	University of the South [etc.]	v.30 (1922)	463-74	485-496	correct	12	2018-01-23 14:42:22	2021-08-05 09:51:28	Article	hvd.32044092797232		
https://hdl.handle.net/2027/njp.32101076384435	Researches on Rhythmic Action	Miyake, Ishiro	Studies from the Yale psychological laboratory.	1902	New Haven, Conn.	Yale university	v.6-10	1-48	511-558	correct	48	2018-01-23 14:56:05	2021-08-05 09:51:52	Article	njp.32101076384435		
https://hdl.handle.net/2027/njp.32101076378189	Review of An Inquiry into the Principles of Harmony in Language, and of the Mechanism of Verse, Modern and Antient by William Mitford, Esquire.	Herbert, William (Dean of Manchester)	The Edinburgh review.	1805	Edinburgh	A. and C. Black	v.6 (Apr.1805-Jul.1805)	357-386	373-402	correct	30	2018-01-23 14:56:07	2021-08-05 09:51:53	Article	njp.32101076378189		
https://hdl.handle.net/2027/hvd.32044009957044	Review of Longfellow's Ballads and Other Poems	(none)	The North American review.	1842	Boston	O. Everett	v.55 (1842)	114-44	140-170	correct	31	2018-01-23 14:44:11	2021-08-05 09:51:34	Article	hvd.32044009957044		
https://hdl.handle.net/2027/njp.32101076378536	Review of Preface to A Vision of Judgment [1821]	(none)	The Edinburgh review.	1821	Edinburgh	A. and C. Black	v.35 (Mar.1821-Jul.1821)	422-36	436-450	correct	15	2018-01-23 14:56:06	2021-08-05 09:51:53	Article	njp.32101076378536		
https://hdl.handle.net/2027/hvd.hnqbsx	The Rhetoric of Verse in Chaucer	Bright, James W.	Publications of the Modern Language Association of America	1901	Baltimore	The Association	v.16 (1901)	xl-xliii	592-595	correct	4	2018-01-23 14:40:00	2021-08-05 09:51:25	Article	hvd.hnqbsx		
https://hdl.handle.net/2027/hvd.32044012418034	Rhyme	Barnes, William	A philological grammar, grounded upon English, and formed from a comparison of more than sixty languages. Being an introduction to the science of grammar and a help to grammars of all languages, especially English, Latin and Greek.	1854	London 	J.R. Smith		277-308	295-326	correct	32	2021-08-05 09:54:10	2021-08-05 09:54:10	Excerpt	hvd.32044012418034		
https://hdl.handle.net/2027/nyp.33433081756896	Rhyme	Ritchie, Frank	Longman's magazine.	1901	London	Longmans, Green and Co.	v. 37 (Nov. 1900-Apr. 1901)	114-24	128-138	correct	11	2018-01-23 15:04:23	2021-08-05 09:52:05	Article	nyp.33433081756896		
https://hdl.handle.net/2027/chi.55220547	Rhyme and Reason	Matthews, J. Brander	The Galaxy.	1875	New York, N.Y.	W.C. and F.P. Church	v.18 1874-75	618-624	624-630	correct	7	2018-01-23 14:32:22	2021-08-05 09:51:18	Article	chi.55220547		
https://hdl.handle.net/2027/njp.32101076889979	Rhymed Hexameters and Pentameters	(none)	Blackwood's Edinburgh magazine.	1846	Edinburgh	William Blackwood	v.59 (1846)	496	502	correct	1	2018-01-23 14:55:32	2021-08-05 09:51:48	Article	njp.32101076889979		
https://hdl.handle.net/2027/chi.79213384	Rhyme nor Reason	[none]	Notes and queries :	1866	London	G. Bell [etc.]	c.1 ser.3 v.10 1865 Jan-Jun	67, 116-117, 236	77, 126-127, 246	correct	4	2018-01-23 14:32:10	2021-08-05 09:51:18	Article	chi.79213384		
https://hdl.handle.net/2027/uiuo.ark:/13960/t4qk01n82	Rhythm	Jenkin, Fleeming.	Saturday review of politics, literature, science and art.	1883			v.55(1883)	270-71	278-279	correct	2	2021-08-05 09:52:12	2021-08-05 09:52:12	Article	uiuo.ark:/13960/t4qk01n82		
https://hdl.handle.net/2027/hvd.32044048962955	Rhythm	Bolton, Thaddeus L	The American journal of psychology.	1893	Urbana [etc.]	University of Illinois Press [etc.]	v.6 (1893)	145-238, 310-11, 488	149-242, 314-315, 492	correct	97	2018-01-23 14:43:22	2021-08-05 09:51:32	Article	hvd.32044048962955		
https://hdl.handle.net/2027/hvd.32044092677376	Rhythm	Kroeger, A. E.	The Southern magazine	1872	Baltimore, Md.	Murdoch, Browne & Hill	v.11  (1872)	220-24	232-236	correct	5	2018-01-23 14:42:32	2023-04-25 13:22:26	Article	hvd.32044092677376		
https://hdl.handle.net/2027/uc1.32106001646766	Rhythm and Metre	Richards, I. A. (Ivor Armstrong), 1893-1979	Principles of literary criticism.	1924	New York	Harcourt, Brace		134-146	144-156	correct	13	2022-01-25 14:29:15	2022-01-25 14:30:23	Excerpt	uc1.32106001646766		
https://hdl.handle.net/2027/uc1.32106015528877	Rhythm and Reason	Untermeyer, Louis	The new republic	1922	New York	The Republic Pub. Co.	v.32 1922	143-44	191-192	correct	2	2018-01-23 15:11:20	2021-08-05 09:52:12	Article	uc1.32106015528877		
https://hdl.handle.net/2027/nyp.33433081672853	Rhythm and Rhyme	Bourne, George	The Living age.	1906	Boston, Mass.	E. Littell & Co.	v. 250 (July - Sept. 1906)	205-210	229-234	231-236	6	2018-01-23 15:04:26	2023-03-02 13:49:48	Article	nyp.33433081672853		
https://hdl.handle.net/2027/njp.32101076426079	Rhythm and Rhyme	Bourne, George	Macmillan's magazine.	1906	London	Macmillan and Co.]	v.93 (1905-1906)	541-49	553-561	correct	9	2018-01-23 14:55:57	2023-03-02 13:49:48	Article	njp.32101076426079		
https://hdl.handle.net/2027/njp.32101076040946	Rhythm and Rhyme.	Stetson, R. H.	The Psychological review.	1903	Lancaster, Pa.	Macmillan	vol.4 (1903)	413-66	447-504	correct	58	2018-01-23 14:56:14	2021-08-05 09:51:56	Article	njp.32101076040946		
https://hdl.handle.net/2027/mdp.39015048893823	Rhythm and Rime Before the Norman Conquest.	Rankin, James W.	Publications of the Modern Language Association of America.	1921	New York, N.Y. [etc.]	Modern Language Association of America.	v.36 1921	401-28	587-614	583-610	28	2018-01-23 14:49:28	2021-08-05 09:51:42	Article	mdp.39015048893823		
https://hdl.handle.net/2027/uc1.b2974316	Rhythm and the Science of Poetry	More, Paul Elmer.	The Sewanee review.	1902	Sewanee, Tenn. [etc.]	University of the South [etc.]	v.10 (1902)	406-17	446-457	correct	12	2018-01-23 15:11:00	2021-08-05 09:52:11	Article	uc1.b2974316		
https://hdl.handle.net/2027/uc2.ark:/13960/t8ff3wr3q	Rhythmical Forms and Melodic Figures	Sharp, Cecil J	English folk song, some conclusions	1907	London	Simpkin & co., ltd.; [etc., etc.]		73-88	95-110	correct	16	2018-01-23 15:15:08	2021-08-05 09:54:31	Excerpt	uc2.ark:/13960/t8ff3wr3q		
https://hdl.handle.net/2027/hvd.hxkepr	Rhythmical Laws	Gomme, G. Laurence.	The Antiquary;	1883	London	E. Stock	v.8 (1883)	12-15	24-27	correct	4	2018-01-23 14:37:22	2021-08-05 09:51:23	Article	hvd.hxkepr		
https://hdl.handle.net/2027/njp.32101076457728	The Rhythmical Line.	Seiberth, Ph	The Journal of English and Germanic philology.	1919	Evanston, Ill.	Journal Pub. Co.	vol. 18 (1919)	242-49	250-257	correct	8	2018-01-23 14:55:53	2021-08-05 09:51:50	Article	njp.32101076457728		
https://hdl.handle.net/2027/coo.31924069259624	Rhythmical Prose in Latin and English	Shelly, John	The Church quarterly review.	1912	London	Spottiswoode	v.74 1912	81-98	89-106	correct	18	2018-01-23 14:32:35	2023-04-27 13:50:38	Article	coo.31924069259624		
https://hdl.handle.net/2027/hvd.32044092640663	The Rhythmic Relation of Prose and Verse.	Hooker, [William] Bryan.	The Forum.	1909	New York	Forum Pub. Co.,	v.41 (1909)	424-37	500-513	494-507	14	2018-01-23 14:42:34	2023-04-25 13:22:54	Article	hvd.32044092640663		
https://hdl.handle.net/2027/njp.32101075673622	Rhythm in English Prose	Fijn Van Draat, P	Anglia.	1912	Halle a/S	M. Niemeyer	Bd.36 (1912)	1-58, 140, 492-538	10-66, 148, 500-546	9-66, 148, 500-546	105	2018-01-23 14:56:22	2021-08-05 09:51:57	Article	njp.32101075673622		
https://hdl.handle.net/2027/mdp.39015049192910	Rhythm in English Verse, Prose, and Speech	MacColl, D. S.	Essays and studies.	1914	London [etc.]	J. Murray [etc.]	v.5 1914	7-50	11-54	correct	44	2018-01-23 14:49:25	2021-08-05 09:51:41	Article	mdp.39015049192910		
https://hdl.handle.net/2027/hvd.32044092796093	Rhythm in Prose	Lipsky, Abram	The Sewanee review.	1908	Sewanee, Tenn. [etc.]	University of the South [etc.]	v.16 (1908)	277-89	299-311	correct	13	2018-01-23 14:42:26	2023-04-27 13:51:25	Article	hvd.32044092796093		
https://hdl.handle.net/2027/mdp.39015030866506	The Rhythm of Oratorical Prose	Parrish, W. M.	Studies in rhetoric and public speaking, in honor of James Albert Winans.	1925	New York	The Century co.		217-231	233-247	correct	15	2022-01-25 14:23:19	2022-01-25 14:26:08	Excerpt	mdp.39015030866506		
https://hdl.handle.net/2027/hvd.32044092797190	The Rhythm of Prose and Free Verse	Andrews, Clarence Edward	The Sewanee review.	1918	Sewanee, Tenn. [etc.]	University of the South [etc.]	v.26 (1918)	183-94	201-212	correct	12	2018-01-23 14:42:24	2021-08-05 09:51:28	Article	hvd.32044092797190		
https://hdl.handle.net/2027/chi.12755443	The Rhythms of Free Verse	Lowell, Amy.	The Dial	1918	Chicago	Jansen, McClurg	v.64 Jan-Jun 1918	51-56	65-70	correct	6	2018-01-23 14:32:26	2021-08-05 09:51:19	Article	chi.12755443		
https://hdl.handle.net/2027/hvd.32044048963029	Rhythm, Time, and Number	MacDougall, Robert	The American journal of psychology.	1902	Urbana [etc.]	University of Illinois Press [etc.]	v.13 (1902)	88-97	96-105	correct	10	2018-01-23 14:43:20	2021-08-05 09:51:31	Article	hvd.32044048963029		
https://hdl.handle.net/2027/hvd.hnqbsr	A Rime-Index to the 'Parent Cycle' of the York Mystery Plays and of a Portion of the Woodkirk Conspiracio et Capito	Coblentz, H. E.	Publications of the Modern Language Association of America	1895	Baltimore	The Association	v.10 (1895)	487-557	513-583	correct	71	2018-01-23 14:40:03	2021-08-05 09:51:26	Article	hvd.hnqbsr		
https://hdl.handle.net/2027/mdp.39015048893831	Rising and Falling Rhythms in English Verse	Creek, Herbert L.	Publications of the Modern Language Association of America.	1920	New York, N.Y. [etc.]	Modern Language Association of America.	v.35 1920	76-90	88-102	correct	15	2018-01-23 14:49:27	2021-08-05 09:51:42	Article	mdp.39015048893831		
https://hdl.handle.net/2027/hvd.32044048963136	The Role of Kinaesthesis in the Perception of Rhythm	Ruckmich, C. A.	The American journal of psychology.	1913	Urbana [etc.]	University of Illinois Press [etc.]	v.24 (1913)	305-59	321-375	correct	55	2018-01-23 14:43:19	2021-08-05 09:51:31	Article	hvd.32044048963136		
https://hdl.handle.net/2027/hvd.32044103001129	The Role of Pitch in Rhythm	Woodrow, Herbert	The Psychological review.	1911	[Washington, etc.]	American Psychological Association [etc.]	v.18 (1911)	54-77	64-87	correct	24	2018-01-23 14:41:15	2023-04-25 12:31:49	Article	hvd.32044103001129		
https://hdl.handle.net/2027/hvd.hxe6bx	Romantic Aspects of the Age of Pope	Havens, Raymond D.	Publications of the Modern Language Association of America	1912	Baltimore	The Association	v.27 (1912)	297-324	319-346	correct	28	2018-01-23 14:38:37	2021-08-05 09:51:24	Article	hvd.hxe6bx		
https://hdl.handle.net/2027/uiug.30112001676896	Sapphics	Swinburne, Algernon Charles.	Poems and ballads. 	1866	London 	John Camden Hotten, Piccadilly		235-238	257-260	255-258	4	2021-08-05 09:54:32	2021-08-05 09:54:32	Excerpt	uiug.30112001676896		*this is poetry
https://hdl.handle.net/2027/inu.30000099671525	The Saturnian Metre	Lindsay, W. M. 	American journal of philology.	1893	Baltimore	Johns Hopkins University Press [etc.]	v.14 1893	305-34	317-346	321-350	30	2018-01-23 14:44:53	2021-08-05 09:51:36	Article	inu.30000099671525		
https://hdl.handle.net/2027/inu.30000099671624	Saturnian Metre	Fraser, John	American journal of philology.	1909	Baltimore	Johns Hopkins University Press [etc.]	v.30 1909	430-46	448-464	correct	17	2018-01-23 14:44:50	2021-08-05 09:51:36	Article	inu.30000099671624		
https://hdl.handle.net/2027/uiug.30112046384886	The Scansion of Middle English Alliterative Verse	Leonard, William E.	Studies in language and literature.	1920	Madison		v.8-11(1920)	58-104	392-438	correct	47	2018-01-23 15:15:14	2021-08-05 09:52:12	Article	uiug.30112046384886		
https://hdl.handle.net/2027/hvd.hnqbtn	The Scansion of Prose Rhythm	Scott, Fred Newton	Publications of the Modern Language Association of America	1905	Baltimore	The Association	v.20 (1905)	707-28	737-758	correct	22	2018-01-23 14:39:58	2021-08-05 09:51:24	Article	hvd.hnqbtn		
https://hdl.handle.net/2027/njp.32101065266304	The Scansion of the Heroic Verse.	Larkins, G. L.	The Academy.	1890	London	J. Murray	v.38 (July-Dec 1890)	616-17	432-433	434-435	2	2018-01-23 14:58:04	2021-08-05 09:52:00	Article	njp.32101065266304		
https://hdl.handle.net/2027/njp.32101076201183	The Scansion of Wyatt's Early Sonnets	Padelford, Frederick M.	Studies in philology.	1923	Chapel Hill, N.C.	University of North Carolina Press	vol. 20	137-52	147-162	correct	16	2021-08-05 09:52:17	2021-08-05 09:52:17	Article	njp.32101076201183		
https://hdl.handle.net/2027/mdp.39015060429381	A Scientific Basis for Metrics	Cobb, Charles W.	Modern language notes.	1913	Baltimore	Johns Hopkins Press [etc.]	v.28 1913	142-45	184-187	176-179	4	2018-01-23 14:47:53	2021-08-05 09:51:40	Article	mdp.39015060429381		
https://hdl.handle.net/2027/njp.32101075672871	Sewing the Silken Seam.	Wimberly, Lowry C	Poet lore.	1919	Washington		vol.30 (1919)	567-78	579-592	correct	14	2018-01-23 14:56:24	2021-08-05 09:51:58	Article	njp.32101075672871		
https://hdl.handle.net/2027/hvd.32044010396893	Shakespeare and "The Taming of the Shrew"	Tolman, Albert H.	The views about Hamlet, and other essays, 	1904	Boston	Houghton, Mifflin		205-42	219-256	correct	38	2018-01-23 14:44:08	2021-08-05 09:54:10	Excerpt	hvd.32044010396893		
https://hdl.handle.net/2027/uc1.b3385477	Shakespeare's Metre	Dawson, Benjamin.	Englische Studien.	1888	New York	Johnson Reprint Corp.	v.11 (1888)	174-76	192-194	correct	3	2018-01-23 15:10:26	2021-08-05 09:52:10	Article	uc1.b3385477		
https://hdl.handle.net/2027/nyp.33433082219621	Shakespeare's Part in The Taming of the Shrew	Tolman, Albert H.	Publications of the Modern Language Association of America	1890	Baltimore	The Association	v. 5 (1890)	201-78	359-436	correct	78	2018-01-23 15:03:44	2021-08-05 09:52:05	Article	nyp.33433082219621		
https://hdl.handle.net/2027/njp.32101064467036	The Shares of Shakespeare and Fletcher in Two Noble Kinsmen	Hickson, Samuel.	The Westminster and foreign quarterly review.	1847	London	John Chapman	v.47 (1847)	59-88	71-100	correct	30	2018-01-23 14:58:16	2021-08-05 09:52:01	Article	njp.32101064467036		
https://hdl.handle.net/2027/hvd.32044031571342	Short Chapters on Novel and Exotic Metres	Benson, Carl	The American Whig review.	1847	New York	Wiley and Putnam, etc.	v.5 (1847)	72-73, 174-75, 502-4	100-101, 212-213, 556-558	correct	7	2018-01-23 14:43:33	2023-04-25 14:26:04	Article	hvd.32044031571342		
https://hdl.handle.net/2027/hvd.32044054989868	Short Chapters on Novel and Exotic Metres	Benson, Carl.	The American Whig review.	1846	New York	Wiley and Putnam, etc.	v.4:1846	482-85	536-539	correct	4	2018-01-23 14:43:14	2021-08-05 09:51:31	Article	hvd.32044054989868		
https://hdl.handle.net/2027/inu.30000099671566	Sidney Lanier and Anglo-Saxon Verse-technic	Morris, John.	American journal of philology.	1899	Baltimore	Johns Hopkins University Press [etc.]	v.20 1899	435-38	447-450	correct	4	2018-01-23 14:44:51	2021-08-05 09:51:36	Article	inu.30000099671566		
https://hdl.handle.net/2027/mdp.39015060429399	Sidney, Spenser, and the Areopagus	Fulton, Edward.	Modern language notes.	1916	Baltimore	Johns Hopkins Press [etc.]	v.31 1916	372-74	442-444	438-440	3	2018-01-23 14:47:52	2021-08-05 09:51:40	Article	mdp.39015060429399		
https://hdl.handle.net/2027/mdp.39015033845689	A Sixth Letter to the Dramatists of the Day	Lacy, John.	The London magazine.	1823	London	Baldwin, Cradock, and Joy [etc.].	v.8 1823 Jul-Dec	645-52	661-668	correct	8	2018-01-23 14:50:05	2021-08-05 09:51:43	Article	mdp.39015033845689		
https://hdl.handle.net/2027/hvd.32044098628274	Some Differences Between Speech-Scansion and Narrative- Scansion in Homeric Verse	Drewitt, J. A. J	Classical quarterly.	1908	Oxford [etc.]	Clarendon Press [etc.]	v.2 (1908)	94-109	110-125	correct	16	2018-01-23 14:41:53	2021-08-05 09:51:27	Article	hvd.32044098628274		
https://hdl.handle.net/2027/mdp.39015059397953	Some Experimental Work in Speech Rhythm	Welch, Constance	The Quarterly journal of speech education: the official organ of the National Association of Teachers of Speech.	1925	[Menasha, Wis.	G. Banta	v.11	247-252	267-272	265-270	6	2022-01-25 14:31:17	2022-01-25 14:33:31	Article	mdp.39015059397953		
https://hdl.handle.net/2027/nyp.33433075914071	Some Features of Chaucer's Verse, especially Stress and Hiatus	Easton, Morton W.	Publications of the Modern Language Association of America	1896	Baltimore	The Association	v. 11 (1896)	xxxiii-xxxiv	585-586	577-578	2	2018-01-23 15:05:04	2021-08-05 09:52:06	Article	nyp.33433075914071		
https://hdl.handle.net/2027/mdp.39015008095104	Some Musical Analogies in Modern Poetry	Lowell, Amy.	The Musical quarterly.	1920	New York [etc.]	G. Schirmer.	v.6 1920	127-57	175-205	173-203	31	2018-01-23 14:53:46	2021-08-05 09:51:45	Article	mdp.39015008095104		
https://hdl.handle.net/2027/njp.32101065270892	Some Recent Studies in English Prosody	Saintsbury, George.	Proceedings of the British Academy.	1920	London	British Academy by H. Frowde, Oxford University Press Warehouse	vol. 9 (1919-20)	79-89	101-111	correct	11	2018-01-23 14:58:02	2023-03-02 13:50:18	Article	njp.32101065270892		
https://hdl.handle.net/2027/hvd.32044092711431	Some Remarks on the Study of English Verse	Van Dyke, Henry.	Atlantic monthly	1903	Boston	Atlantic Monthly Co.	v.92 (1903)	469-75	503-509	correct	7	2018-01-23 14:42:30	2021-08-05 09:51:29	Article	hvd.32044092711431		
https://hdl.handle.net/2027/coo.31924066518758	Some Thoughts on the Technique of Poetry	Keary, C. F.	The Fortnightly review	1906	London	Chapman and Hall	v.86 1906:July-Dec.	811-826	819-834	correct	16	2018-01-23 14:32:36	2021-08-05 09:51:20	Article	coo.31924066518758		
https://hdl.handle.net/2027/uc1.ax0003129954	The Sonnet	Lynch, Arthur, 1861-1934	Sonnets of the banner and the star : with an essay on the sonnet as an instrument of poetry.	1914	London	E. Mathews		7-57	11-61	correct	51	2023-08-04 11:38:13	2023-08-04 11:40:55	Excerpt	uc1.ax0003129954		
https://hdl.handle.net/2027/njp.32101076472909	The Sonnet Forms of Wyatt and Surrey	Lathrop, H. B.	Modern philology.	1905	Chicago	University of Chicago Press	vol.2 (1904-1905)	463-70	473-480	correct	8	2018-01-23 14:55:47	2021-08-05 09:51:49	Article	njp.32101076472909		
https://hdl.handle.net/2027/mdp.39015060429480	The Sonnet Forms of Wyatt and Surrey	Hanscom, Elizabeth D.	Modern language notes.	1901	Baltimore	Johns Hopkins Press [etc.]	v.16 1901	137-140	171-174	163-166	4	2018-01-23 14:47:47	2021-08-05 09:51:39	Article	mdp.39015060429480		
https://hdl.handle.net/2027/mdp.39015030936325	The sonnet in England	Noble, James Ashcroft, 1844-1896	The sonnet in England, & other essays.	1893	London	E. Mathews and John Lane		1-63	23-85	correct	63	2023-08-04 11:31:07	2023-08-04 11:34:25	Excerpt	mdp.39015030936325		
https://hdl.handle.net/2027/hvd.32044098641632	Sonnet Structure in Sidney's Astrophel and Stella	Whigam, R. G., and O. F. Emerson.	Studies in philology.	1921	Chapel Hill [etc.]	University of North Carolina Press [etc.]	v.18 (1921)	347-52	375-380	correct	6	2018-01-23 14:41:52	2021-08-05 09:51:26	Article	hvd.32044098641632		
https://hdl.handle.net/2027/njp.32101075672855	Sound Magic in Poetry.	Craig, Anne T	Poet lore.	1918	Washington		vol.29 (1918)	596-605	608-617	correct	10	2018-01-23 14:56:25	2021-08-05 09:51:58	Article	njp.32101075672855		
https://hdl.handle.net/2027/chi.79279237	Speaking to the Psaltery	Yeats, W. B.	The Monthly review ...	1902	London	J. Murray; [etc., etc.	v.7 1902	94-99	314-321	correct	8	2018-01-23 14:32:09	2023-04-25 10:33:22	Article	chi.79279237		
https://hdl.handle.net/2027/hvd.32044011590692	The 'Speech-Ending' Test Applied to Twenty of Shakespeare's Plays	Pulling, F. S.	Transactions.	1879	London	New Shakespeare Society	v.5-7 (1877-79)	457-58	513-514	correct	2	2018-01-23 14:44:04	2021-08-05 09:51:34	Article	hvd.32044011590692		
https://hdl.handle.net/2027/njp.32101076472917	The Spenserian Before 1700	Morton, Edward P.	Modern philology.	1907	Chicago	University of Chicago Press	vol.4 (1906-1907)	639-54	651-666	649-664	16	2018-01-23 14:55:46	2021-08-05 09:51:49	Article	njp.32101076472917		
https://hdl.handle.net/2027/mdp.39015059402340	Spenserian Prosody: The Couplet Forms	Shipley. Joseph T.	Studies in philology.	1924	Chapel Hill [etc.]	University of North Carolina Press [etc.]	v.21	594-615	616-637	614-635	22	2021-01-14 15:54:23	2021-08-05 09:52:14	Article	mdp.39015059402340		
https://hdl.handle.net/2027/umn.31951002792970z	The Spenserian Stanza	Taboreux, Etienne.	Revue de l'enseignement des langues vivantes.	1900	Paris		annee 16 (1899/1900)	14-21, 112-18, 163-72	22-29, 120-126, 171-180	correct	25	2018-01-23 15:15:25	2021-08-05 09:52:13	Article	umn.31951002792970z		
https://hdl.handle.net/2027/njp.32101076472958	The Spenserian Stanza in the Eighteenth Century	Morton, Edward P.	Modern philology.	1913	Chicago	University of Chicago Press	vol.10 (1912-1913)	365-91	377-403	correct	27	2018-01-23 14:55:45	2021-08-05 09:51:49	Article	njp.32101076472958		
https://hdl.handle.net/2027/mdp.39015060430116	Stanza-Connections in the Fairy Queen	Brooke, Tucker	Modern language notes.	1922	Baltimore	Johns Hopkins Press [etc.]	v.37 1922	223-27	267-271	265-269	5	2018-01-23 14:47:39	2021-08-05 09:51:38	Article	mdp.39015060430116		
https://hdl.handle.net/2027/njp.32101076472933	The Stanza-Forms of Sir Thopas	Manly, John M.	Modern philology.	1911	Chicago	University of Chicago Press	vol.8 (1910-1911)	141-44	153-156	correct	4	2018-01-23 14:55:46	2021-08-05 09:51:49	Article	njp.32101076472933		
https://hdl.handle.net/2027/mdp.39015060430058	Stanzaic Division in York Play XXXIX	Miller, Francis H.	Modern language notes.	1920	Baltimore	Johns Hopkins Press [etc.]	v.35 1920	379-80	421-422	correct	2	2018-01-23 14:47:40	2021-08-05 09:51:38	Article	mdp.39015060430058		
https://hdl.handle.net/2027/mdp.39015060430371	Stanza-linking in Middle English Verse	Medary, M. P., and A. C. L. Brown.	Romanic review	1916	New York	Dept. of French and Romance Philology of Columbia University [etc.]	v.7 1916	243-70	263-290	261-288	28	2018-01-23 14:47:38	2021-08-05 09:51:38	Article	mdp.39015060430371		
